{
  "schema_id": "OPL-GOLDEN-COVERAGE-CATALOG-001",
  "schema_version": "0.1",
  "catalog_id": "coverage.opl.iso19450.2024.draft",
  "catalog_version": "0.1.0",
  "summary": {
    "total": 178,
    "pass": 130,
    "blocked": 48
  },
  "requirements": [
    {
      "coverage_key": "PROC:CAP-ISO-PROC-001:-:CONSUMPTION_OBJECT:PASS",
      "case_id": "G-OPL-PROC-001.CONSUMPTION_OBJECT.PASS",
      "family": "PROC",
      "capability_id": "CAP-ISO-PROC-001",
      "variant_key": "CONSUMPTION_OBJECT",
      "expectation": "PASS",
      "dimensions": {},
      "required_template_ids": [
        "opl.consumption.v1"
      ],
      "expected_sentence_slots": [
        "SINGLE"
      ]
    },
    {
      "coverage_key": "PROC:CAP-ISO-PROC-001:-:ENDPOINTS_REVERSED:BLOCKED",
      "case_id": "G-OPL-PROC-001.ENDPOINTS_REVERSED.BLOCKED",
      "family": "PROC",
      "capability_id": "CAP-ISO-PROC-001",
      "variant_key": "ENDPOINTS_REVERSED",
      "expectation": "BLOCKED",
      "dimensions": {},
      "expected_error_code": "ENDPOINT_KIND_MISMATCH"
    },
    {
      "coverage_key": "PROC:CAP-ISO-PROC-002:-:RESULT_OBJECT:PASS",
      "case_id": "G-OPL-PROC-002.RESULT_OBJECT.PASS",
      "family": "PROC",
      "capability_id": "CAP-ISO-PROC-002",
      "variant_key": "RESULT_OBJECT",
      "expectation": "PASS",
      "dimensions": {},
      "required_template_ids": [
        "opl.result.v1"
      ],
      "expected_sentence_slots": [
        "SINGLE"
      ]
    },
    {
      "coverage_key": "PROC:CAP-ISO-PROC-002:-:ENDPOINTS_REVERSED:BLOCKED",
      "case_id": "G-OPL-PROC-002.ENDPOINTS_REVERSED.BLOCKED",
      "family": "PROC",
      "capability_id": "CAP-ISO-PROC-002",
      "variant_key": "ENDPOINTS_REVERSED",
      "expectation": "BLOCKED",
      "dimensions": {},
      "expected_error_code": "ENDPOINT_KIND_MISMATCH"
    },
    {
      "coverage_key": "PROC:CAP-ISO-PROC-003:-:EFFECT_OBJECT:PASS",
      "case_id": "G-OPL-PROC-003.EFFECT_OBJECT.PASS",
      "family": "PROC",
      "capability_id": "CAP-ISO-PROC-003",
      "variant_key": "EFFECT_OBJECT",
      "expectation": "PASS",
      "dimensions": {},
      "required_template_ids": [
        "opl.effect.v1"
      ],
      "expected_sentence_slots": [
        "SINGLE"
      ]
    },
    {
      "coverage_key": "PROC:CAP-ISO-PROC-003:-:ENDPOINTS_REVERSED:BLOCKED",
      "case_id": "G-OPL-PROC-003.ENDPOINTS_REVERSED.BLOCKED",
      "family": "PROC",
      "capability_id": "CAP-ISO-PROC-003",
      "variant_key": "ENDPOINTS_REVERSED",
      "expectation": "BLOCKED",
      "dimensions": {},
      "expected_error_code": "ENDPOINT_KIND_MISMATCH"
    },
    {
      "coverage_key": "PROC:CAP-ISO-PROC-004:-:AGENT_OBJECT:PASS",
      "case_id": "G-OPL-PROC-004.AGENT_OBJECT.PASS",
      "family": "PROC",
      "capability_id": "CAP-ISO-PROC-004",
      "variant_key": "AGENT_OBJECT",
      "expectation": "PASS",
      "dimensions": {},
      "required_template_ids": [
        "opl.agent.v1"
      ],
      "expected_sentence_slots": [
        "SINGLE"
      ]
    },
    {
      "coverage_key": "PROC:CAP-ISO-PROC-004:-:ENDPOINTS_REVERSED:BLOCKED",
      "case_id": "G-OPL-PROC-004.ENDPOINTS_REVERSED.BLOCKED",
      "family": "PROC",
      "capability_id": "CAP-ISO-PROC-004",
      "variant_key": "ENDPOINTS_REVERSED",
      "expectation": "BLOCKED",
      "dimensions": {},
      "expected_error_code": "ENDPOINT_KIND_MISMATCH"
    },
    {
      "coverage_key": "PROC:CAP-ISO-PROC-005:-:INSTRUMENT_OBJECT:PASS",
      "case_id": "G-OPL-PROC-005.INSTRUMENT_OBJECT.PASS",
      "family": "PROC",
      "capability_id": "CAP-ISO-PROC-005",
      "variant_key": "INSTRUMENT_OBJECT",
      "expectation": "PASS",
      "dimensions": {},
      "required_template_ids": [
        "opl.instrument.v1"
      ],
      "expected_sentence_slots": [
        "SINGLE"
      ]
    },
    {
      "coverage_key": "PROC:CAP-ISO-PROC-005:-:ENDPOINTS_REVERSED:BLOCKED",
      "case_id": "G-OPL-PROC-005.ENDPOINTS_REVERSED.BLOCKED",
      "family": "PROC",
      "capability_id": "CAP-ISO-PROC-005",
      "variant_key": "ENDPOINTS_REVERSED",
      "expectation": "BLOCKED",
      "dimensions": {},
      "expected_error_code": "ENDPOINT_KIND_MISMATCH"
    },
    {
      "coverage_key": "PROC:CAP-ISO-PROC-006:-:CONSUMPTION_STATE:PASS",
      "case_id": "G-OPL-PROC-006.CONSUMPTION_STATE.PASS",
      "family": "PROC",
      "capability_id": "CAP-ISO-PROC-006",
      "variant_key": "CONSUMPTION_STATE",
      "expectation": "PASS",
      "dimensions": {},
      "required_template_ids": [
        "opl.consumption.state.v1"
      ],
      "expected_sentence_slots": [
        "SINGLE"
      ]
    },
    {
      "coverage_key": "PROC:CAP-ISO-PROC-006:-:STATE_OWNER_MISMATCH:BLOCKED",
      "case_id": "G-OPL-PROC-006.STATE_OWNER_MISMATCH.BLOCKED",
      "family": "PROC",
      "capability_id": "CAP-ISO-PROC-006",
      "variant_key": "STATE_OWNER_MISMATCH",
      "expectation": "BLOCKED",
      "dimensions": {},
      "expected_error_code": "STATE_OWNER_MISMATCH"
    },
    {
      "coverage_key": "PROC:CAP-ISO-PROC-007:-:RESULT_STATE:PASS",
      "case_id": "G-OPL-PROC-007.RESULT_STATE.PASS",
      "family": "PROC",
      "capability_id": "CAP-ISO-PROC-007",
      "variant_key": "RESULT_STATE",
      "expectation": "PASS",
      "dimensions": {},
      "required_template_ids": [
        "opl.result.state.v1"
      ],
      "expected_sentence_slots": [
        "SINGLE"
      ]
    },
    {
      "coverage_key": "PROC:CAP-ISO-PROC-007:-:STATE_OWNER_MISMATCH:BLOCKED",
      "case_id": "G-OPL-PROC-007.STATE_OWNER_MISMATCH.BLOCKED",
      "family": "PROC",
      "capability_id": "CAP-ISO-PROC-007",
      "variant_key": "STATE_OWNER_MISMATCH",
      "expectation": "BLOCKED",
      "dimensions": {},
      "expected_error_code": "STATE_OWNER_MISMATCH"
    },
    {
      "coverage_key": "PROC:CAP-ISO-PROC-008:-:EFFECT_INPUT_OUTPUT_STATE:PASS",
      "case_id": "G-OPL-PROC-008.EFFECT_INPUT_OUTPUT_STATE.PASS",
      "family": "PROC",
      "capability_id": "CAP-ISO-PROC-008",
      "variant_key": "EFFECT_INPUT_OUTPUT_STATE",
      "expectation": "PASS",
      "dimensions": {},
      "required_template_ids": [
        "opl.effect.state.input-output.v1"
      ],
      "expected_sentence_slots": [
        "SINGLE"
      ]
    },
    {
      "coverage_key": "PROC:CAP-ISO-PROC-008:-:INPUT_STATE_OWNER_MISMATCH:BLOCKED",
      "case_id": "G-OPL-PROC-008.INPUT_STATE_OWNER_MISMATCH.BLOCKED",
      "family": "PROC",
      "capability_id": "CAP-ISO-PROC-008",
      "variant_key": "INPUT_STATE_OWNER_MISMATCH",
      "expectation": "BLOCKED",
      "dimensions": {},
      "expected_error_code": "STATE_OWNER_MISMATCH"
    },
    {
      "coverage_key": "PROC:CAP-ISO-PROC-008:-:OUTPUT_STATE_OWNER_MISMATCH:BLOCKED",
      "case_id": "G-OPL-PROC-008.OUTPUT_STATE_OWNER_MISMATCH.BLOCKED",
      "family": "PROC",
      "capability_id": "CAP-ISO-PROC-008",
      "variant_key": "OUTPUT_STATE_OWNER_MISMATCH",
      "expectation": "BLOCKED",
      "dimensions": {},
      "expected_error_code": "STATE_OWNER_MISMATCH"
    },
    {
      "coverage_key": "PROC:CAP-ISO-PROC-009:-:EFFECT_INPUT_STATE:PASS",
      "case_id": "G-OPL-PROC-009.EFFECT_INPUT_STATE.PASS",
      "family": "PROC",
      "capability_id": "CAP-ISO-PROC-009",
      "variant_key": "EFFECT_INPUT_STATE",
      "expectation": "PASS",
      "dimensions": {},
      "required_template_ids": [
        "opl.effect.state.input.v1"
      ],
      "expected_sentence_slots": [
        "SINGLE"
      ]
    },
    {
      "coverage_key": "PROC:CAP-ISO-PROC-009:-:INPUT_STATE_OWNER_MISMATCH:BLOCKED",
      "case_id": "G-OPL-PROC-009.INPUT_STATE_OWNER_MISMATCH.BLOCKED",
      "family": "PROC",
      "capability_id": "CAP-ISO-PROC-009",
      "variant_key": "INPUT_STATE_OWNER_MISMATCH",
      "expectation": "BLOCKED",
      "dimensions": {},
      "expected_error_code": "STATE_OWNER_MISMATCH"
    },
    {
      "coverage_key": "PROC:CAP-ISO-PROC-010:-:EFFECT_OUTPUT_STATE:PASS",
      "case_id": "G-OPL-PROC-010.EFFECT_OUTPUT_STATE.PASS",
      "family": "PROC",
      "capability_id": "CAP-ISO-PROC-010",
      "variant_key": "EFFECT_OUTPUT_STATE",
      "expectation": "PASS",
      "dimensions": {},
      "required_template_ids": [
        "opl.effect.state.output.v1"
      ],
      "expected_sentence_slots": [
        "SINGLE"
      ]
    },
    {
      "coverage_key": "PROC:CAP-ISO-PROC-010:-:OUTPUT_STATE_OWNER_MISMATCH:BLOCKED",
      "case_id": "G-OPL-PROC-010.OUTPUT_STATE_OWNER_MISMATCH.BLOCKED",
      "family": "PROC",
      "capability_id": "CAP-ISO-PROC-010",
      "variant_key": "OUTPUT_STATE_OWNER_MISMATCH",
      "expectation": "BLOCKED",
      "dimensions": {},
      "expected_error_code": "STATE_OWNER_MISMATCH"
    },
    {
      "coverage_key": "PROC:CAP-ISO-PROC-011:-:AGENT_STATE:PASS",
      "case_id": "G-OPL-PROC-011.AGENT_STATE.PASS",
      "family": "PROC",
      "capability_id": "CAP-ISO-PROC-011",
      "variant_key": "AGENT_STATE",
      "expectation": "PASS",
      "dimensions": {},
      "required_template_ids": [
        "opl.agent.state.v1"
      ],
      "expected_sentence_slots": [
        "SINGLE"
      ]
    },
    {
      "coverage_key": "PROC:CAP-ISO-PROC-011:-:STATE_OWNER_MISMATCH:BLOCKED",
      "case_id": "G-OPL-PROC-011.STATE_OWNER_MISMATCH.BLOCKED",
      "family": "PROC",
      "capability_id": "CAP-ISO-PROC-011",
      "variant_key": "STATE_OWNER_MISMATCH",
      "expectation": "BLOCKED",
      "dimensions": {},
      "expected_error_code": "STATE_OWNER_MISMATCH"
    },
    {
      "coverage_key": "PROC:CAP-ISO-PROC-012:-:INSTRUMENT_STATE:PASS",
      "case_id": "G-OPL-PROC-012.INSTRUMENT_STATE.PASS",
      "family": "PROC",
      "capability_id": "CAP-ISO-PROC-012",
      "variant_key": "INSTRUMENT_STATE",
      "expectation": "PASS",
      "dimensions": {},
      "required_template_ids": [
        "opl.instrument.state.v1"
      ],
      "expected_sentence_slots": [